{"alias_prepared_image_ids":["pi1"],"alias_refcount":1,"allocation_digest":"sha256:99a2d92beaffcdca9eca6c68451fc9f19d36e6ae97442080725e03890170e213","allocation_id":"alloc-ws1","boot_epoch":7,"canonical_bytes":400,"device_id":"op15","dtype":"f16","kind":"canonical_allocation","layout_version":3,"lease_refcount":1,"reclaimable":false,"residency_generation":2,"schema_version":4,"soc":"op15","weight_set_digest":"sha256:3fa601b781e2ade54ab442125e635520389c4289329ba9ec2fd819e8e165ebc2","weight_set_id":"ws1"}
